id,title,doi,crossref_paper_link,pdf_url,paper_text,resolver_error,content_type,extracted_info,type
9263429,Koevoets R; Dirven L; Klarenbeek NB; van Krugten MV; Ronday HK; van der Heijde DM; Huizinga TW; Kerstens PS; Lems WF; Allaart CF. 'Insights in the relationship of joint space narrowing versus erosive joint damage and physical functioning of patients with RA'. Annals of the rheumatic diseases. (2013) 72 6 pp870-874,10.1136/annrheumdis-2011-201191,,,,Missing EZProxy credentials.,unreachable,,na
9263626,"Loef M; Kroon FP; Bergstra SA; Van Der Pol JA; Lems WF; Kerstens PJ; Allaart CF; Kloppenburg M. Tumor necrosis factor-inhibitor treatment duration is associated with lower risk of hand osteoarthritis progression in patients with recent-onset rheumatoid arthritis after 10-year follow-up. Osteoarthritis and cartilage. (2018) Conference: 2018 Osteoarthritis Research Society International, OARSI World Congress. United Kingdom. 26 Supplement 1 ppS300-S301",10.1016/j.joca.2018.02.604,,,,Missing EZProxy credentials.,unreachable,,na
9739099,Koevoets R; Klarenbeek N B; Van Der Heijde; D M F M; Van Krugten; M V; Van Schaardenburg; Dijkmans B; Huizinga T W J. Being in remission or in low disease activity in rheumatoid arthritis: different meaning with the use of different composite scores. Arthritis and rheumatism. (2009) 60 SUPPL. 10 pp957,10.1002/art.24661,,,,Missing EZProxy credentials.,unreachable,,na
9739444,Koevoets R; Klarenbeek NB; Van Der Heijde DMFM; Van Krugten MV; Van Schaardenburg D; Dijkmans B; Huizinga TWJ. Being in remission or in low disease activity in rheumatoid arthritis: different meaning with the use of different composite scores. Arthritis and rheumatism. (2009) 60  pp957-,10.1002/art.24661,,,,Missing EZProxy credentials.,unreachable,,na
9740040,ISRCTN32675862. Treatment strategies for Rheumatoid Arthritis (BeSt - BehandelStrategie‚Äö√Ñ√∂‚àö‚Ä†‚àö‚àÇ¬¨¬®¬¨‚Ä¢n in Reumato‚Äö√Ñ√∂‚àö‚Ä†‚àö‚àÇ‚Äö√†√∂‚àö‚â§de Artritis). http://www.who.int/trialsearch/Trial2.aspx?TrialID=ISRCTN32675862. (2005)   pp,10.4324/9780203187838.bmatt3,,,,[Errno 11001] getaddrinfo failed,unreachable,,na
11087242,Van Der Pol J; Bergstra SA; Huizinga T; Allaart C. PREDNISONE USE and the INCIDENCE of HYPERGLYCEMIA or DIABETES in PATIENTS with RHEUMATOID ARTHRITIS; A 10-YEAR SUB ANALYSIS of the BEST STUDY. Annals of the rheumatic diseases. (2022) 81 Supplement 1 pp181,10.1136/annrheumdis-2022-eular.4474,,,,Missing EZProxy credentials.,unreachable,,na
9743074,Bergstra Sytske Anne; Van Der Pol Joy A; Riyazi Naghmeh; Goekoop-Ruiterman Yvonne P M; Kerstens Pit J S M; Lems Willem; Huizinga Tom W J; Allaart Cornelia F. Earlier is better when treating rheumatoid arthritis: but can we detect a window of opportunity?. RMD open. (2020) 6 1 pp,10.1136/rmdopen-2020-001242,,https://rmdopen.bmj.com/rmdopen/6/1/e001242.full.pdf,,,pdf,,Page Not Found
9737262,UMIN000030760. A pilot study of a simple navigation system for artificial hip joint surgery using augmented reality technology. http://www.who.int/trialsearch/Trial2.aspx?TrialID=JPRN-UMIN000030760. (2018)   pp,10.1016/j.jjoisr.2024.06.002,,,,Missing EZProxy credentials.,unreachable,,na
9740192,"EUCTR2015-000581-58-CZ. A Randomized,Biomarker Trial to Predict Therapeutic Responses of Patients with Rheumatoid Arthritis to a Specific Biologic Mode of Action. http://www.who.int/trialsearch/Trial2.aspx?TrialID=EUCTR2015-000581-58-CZ. (2015)   pp",10.1186/isrctn43336433,,,,Missing EZProxy credentials.,unreachable,,na
11083927,"Studenic P; Bond G; Kerschbaumer A; Becede M; Pavelka K; Karateev D; Stieger J; Puchner R; Mueller RB; Puchhammer-Stockl E; Durechova M; Loiskandl M; Perkmann T; Olejarova M; Luchikhina E; Steiner C-W; Bonelli M; Smolen JS; Aletaha D. Torque Teno Virus Quantification for Monitoring of Immunomodulation with Biological Compounds in the Treatment of Rheumatoid Arthritis. Rheumatology (Oxford, England). (2021) 61 7 pp2815-2825",10.1093/rheumatology/keab839,https://academic.oup.com/rheumatology/advance-article-pdf/doi/10.1093/rheumatology/keab839/42378011/keab839.pdf,https://academic.oup.com/rheumatology/advance-article-pdf/doi/10.1093/rheumatology/keab839/42378011/keab839.pdf,,,pdf,,PDF
9257681,"Nasonov E; Mazurov V; Plaksina T; Nesmeyanova O; Knyazeva L; Eremeeva A; Chernyaeva E; Ivanov R. Interchangeability of innovator rituximab and its biosimilar: results from international controlled comparative 1-year study in patients with active rheumatoid arthritis. Arthritis and rheumatology. Conference: american college of rheumatology/association of rheumatology health professionals annual scientific meeting, ACR/ARHP 2016. United states. Conference start: 20161111. Conference end: 20161116. (2016) 68  pp2046-2047",10.1002/art.39977,,,,Missing EZProxy credentials.,unreachable,,na
9742604,"Eremeeva A; Chernyaeva E; Ivanov R; Nasonov E; Knyazeva L. Comparison of efficacy and safety of rituximab biosimilar, BCD-020, and innovator rituximab in patients with active rheumatoid arthritis refractory to TNFa inhibitors. Annals of the rheumatic diseases. (2016) 75 Supplement 2 pp513-514",10.1136/annrheumdis-2016-eular.1715,,,,Missing EZProxy credentials.,unreachable,,na
9261496,Kivitz A; Olech E; Borofsky MA; Zazueta BM; Navarro-Sarabia F; Radominski SC; Merrill JT; Wells C; Wimalasundera S; Douglass W; Pope JE. The safety and efficacy of tocilizumab subcutaneous in combination with traditional DMARDS in patients with moderate to severe rheumatoid arthritis up to 48 weeks (BREVACTA). Arthritis and rheumatism. (2013) 65 var.pagings ppS604-S605,10.1002/acr.22384,https://onlinelibrary.wiley.com/doi/pdf/10.1002/acr.22384,https://onlinelibrary.wiley.com/doi/pdf/10.1002/acr.22384,,,html,,PDF
9737343,"EUCTR2010-019912-18-ES. A randomized, double-blind, parallel-group study of safety and the effect on clinical outcome of tocilizumab SC versus placebo SC in combination with traditional disease modifying anti-rheumatic drugs (DMARDs), in patients with moderate to severe active rheumatoid arthritis. Estudio randomizado, doble ciego, con grupos de tratamiento paralelos, para evaluar la seguridad y el efecto sobre el resultado cl√≠nico de tocilizumab SC frente a placebo SC en combinaci√≥n con f√°rmacos antirreum√°ticos modificadores de la enfermedad (FAMEs) tradicionales, en pacientes con artritis reumatoide activa moderada a severa. http://www.who.int/trialsearch/Trial2.aspx?TrialID=EUCTR2010-019912-18-ES. (2011)   pp",10.1016/j.acuro.2024.05.005,,,,Missing EZProxy credentials.,unreachable,,na
9262262,"Abdallah H; Hsu JC; Lu P; Fettner S; Zhang X; Douglass W; Bao M; Rowell L; Burmester GR; Kivitz A. Pharmacokinetic and Pharmacodynamic Analysis of Subcutaneous Tocilizumab in Patients With Rheumatoid Arthritis From 2 Randomized, Controlled Trials: SUMMACTA and BREVACTA. Journal of clinical pharmacology. (2017) 57 4 pp459-468",10.1002/jcph.826,https://api.wiley.com/onlinelibrary/tdm/v1/articles/10.1002%2Fjcph.826,https://api.wiley.com/onlinelibrary/tdm/v1/articles/10.1002%2Fjcph.826,,,html,,Page Not Found
9738583,"Harrison M; Boonen A; Tugwell P; Symmons D. Same question, different answer: a comparison of global health assessments using vas scales. Rheumatology.. (2009) 48  ppi110",10.1007/s11136-009-9546-3,http://link.springer.com/article/10.1007/s11136-009-9546-3/fulltext.html,http://www.shef.ac.uk/content/1/c6/01/87/47/04_6FT.pdf,,,pdf,,Page Not Found
9257165,Kameda H; Kurasawa T; Nagasawa H; Amano K; Takeuchi T. The addition of another disease-modifying anti-rheumatic drug to methotrexate in place of infliximab reduces the flare rate during 2 years after infliximab discontinuation in patients with rheumatoid arthritis. Arthritis and rheumatism. (2012) 64  ppS206,10.3109/14397595.2013.844886,,,,Missing EZProxy credentials.,unreachable,,na
9258391,"Glintborg B; Sorensen IJ; Jensen DV; Krogh NS; Loft AG; Espesen J; Olsen J; Hendricks O; Grydehoj J; Hansen IMJ; Sorensen MV; Chrysidis S; Andersen BL; Manilo N; Klarlund M; Andersen LS; Nordin H; Kristensen S; Norregaard J; Hetland ML. A nationwide non-medical switch from originator to biosimilar infliximab in patients with inflammatory arthritis. Eleven months' clinical outcomes from the Danbio registry. Arthritis and rheumatology. Conference: american college of rheumatology/association of rheumatology health professionals annual scientific meeting, ACR/ARHP 2016. United states. Conference start: 20161111. Conference end: 20161116. (2016) 68  pp1255-1258",10.1136/annrheumdis-2016-eular.1785,,,,Missing EZProxy credentials.,unreachable,,na
9258402,"Bykerk VP; Emery P; Weinblatt M; Burmester G-R; Furst DE; Mariette X; Van Vollenhoven R; Purcaru O; Ralston P; Bingham C. Cinical responses and improvements in patient-reported outcomes are associated with increased productivity in the workplace and at home in rheumatoid arthritis patients treated with certolizumab pegol. Arthritis and rheumatology. Conference: american college of rheumatology/association of rheumatology health professionals annual scientific meeting, ACR/ARHP 2016. United states. Conference start: 20161111. Conference end: 20161116. (2016) 68  pp775-776",10.1016/j.jval.2016.09.1150,,,,Missing EZProxy credentials.,unreachable,,na
9261831,"Weinblatt M; Bingham C; Burmester G; Bykerk VP; Furst DE; Mariette X; Van Der Heijde D; Tatla D; Arendt C; Mountian I; Van Lunen B; Emery P. Certolizumab pegol in combination with methotrexate in dmard-naive patients with active, severe, progressive rheumatoid arthritis: results from a randomized, double-blind, controlled phase 3 study. Arthritis and rheumatology. (2015) 67 no pagination pp",10.1136/annrheumdis-2015-eular.1493,,,,Missing EZProxy credentials.,unreachable,,na
9261866,"Emery P; Bingham CO; Burmester G-R; Bykerk VP; Furst DE; Mariette X; Van Der Heijde D; Tatla D; Arendt C; Mountian I; Van Lunen B; Weinblatt M. The first study of certolizumab pegol in combination with methotrexate in dmard-naive early rheumatoid arthritis patients led to sustained clinical response and inhibition of radiographic progression at 52 weeks: the c-early randomized, double-blind, controlled phase 3 study. Annals of the rheumatic diseases. (2015) 74  pp712",10.1136/annrheumdis-2015-eular.1493,,,,Missing EZProxy credentials.,unreachable,,na
9261923,"Emery P; Bingham C; Burmester G; Bykerk V; Furst D; Mariette X; Purcaru O; Coteur G; Vanlunen B; Weinblatt M. Improvements in patient-reported outcomes following 52 weeks of treatment with certolizumab pegol in combination with methotrexate in dmard-naive patients with severe, active and progressive rheumatoid arthritis: results from the c-early randomized, double-blind, controlled phase 3 study. Value in health. (2015) 18 7 ppA707-A708",10.1016/j.jval.2015.09.2660,,,,Missing EZProxy credentials.,unreachable,,na
9262077,Bykerk VP; Emery P; Weinblatt ME; Burmester G; Furst DE; Mariette X; Van Vollenhoven R; Ralston P; Purcaru O; Bingham C. Clinical responses and improvements in patient-reported outcomes are associated with increased productivity in the workplace and at home in rheumatoid arthritis patients treated with certolizumab pegol. Value in health. Conference: ISPOR 19th annual european congress. Austria. Conference start: 20161029. Conference end: 20161102. (2016) 19 7 ppA545,10.1016/j.jval.2016.09.1150,,,,Missing EZProxy credentials.,unreachable,,na
9740280,"EUCTR2011-001729-25-GB. Study designed to demonstrate the efficacy and safety of Certolizumab pegol in combination with Methotrexate in the treatment of subjects suffering from early, progressive active rheumatoid arthritis. http://www.who.int/trialsearch/Trial2.aspx?TrialID=EUCTR2011-001729-25-GB. (2012)   pp",10.1007/s00393-016-0133-z,http://link.springer.com/article/10.1007/s00393-016-0133-z/fulltext.html,http://link.springer.com/article/10.1007/s00393-016-0133-z/fulltext.html,,,html,,Article
9741121,"NCT01521923. A Multi-center, Randomized, Double-blind, Placebo-controlled Study to Evaluate the Efficacy and Safety of Certolizumab Pegol in Combination With Methotrexate in the Treatment of Disease Modifying Antirheumatic Drugs (DMARD)-naïve Adults With Early Active Rheumatoid Arthritis. https://clinicaltrials.gov/show/NCT01521923. (2012)   pp",10.1016/j.clinthera.2009.08.014,,,,Missing EZProxy credentials.,unreachable,,na
9258378,"Tanaka Y; Atsumi T; Yamamoto K; Takeuchi T; Yamanaka H; Ishiguro N; Eguchi K; Watanabe A; Origasa H; Shoji T; Ralston P; Van Der Heijde D; Miyasaka N; Koike T. Maintenance of clinical remission and radiographic non-progression with mtx after completion of 1 year initial treatment with certolizumab pegol in Japanese patients with early rheumatoid arthritis. Arthritis and rheumatology. Conference: american college of rheumatology/association of rheumatology health professionals annual scientific meeting, ACR/ARHP 2016. United states. Conference start: 20161111. Conference end: 20161116. (2016) 68  pp4315-4317",10.3109/14397595.2014.904475,,,,Missing EZProxy credentials.,unreachable,,na
9261864,"Atsumi T; Yamamoto K; Takeuchi T; Yamanaka H; Ishiguro N; Tanaka Y; Eguchi K; Watanabe A; Origasa H; Shoji T; Togo O; Okada T; Van Der Heijde D; Miyasaka N; Koike T. Baseline parameters identified in early, methotrexate-naive rheumatoid arthritis patients with better outcomes with certolizumab pegol+methotrexate compared to placebo+methotrexate: post-hoc analyses of c-opera, a randomized, controlled, phase 3 study. Annals of the Rheumatic Diseases.Conference: Annual European Congress of Rheumatology of the European League Against Rheumatism, EULAR 2015 Rome Italy.Conference Start: 20150610 Conference End: 20150613.Conference Publication: (var.pagings). (2015) 74  pp716-717",10.1136/annrheumdis-2015-eular.1501,,,,Missing EZProxy credentials.,unreachable,,na
9261584,Burmester GR; Kivitz AJ; Kupper H; Arulmani U; Florentinus S; Goss SL; Rathmann SS; Fleischmann RM. Efficacy and safety of ascending methotrexate dose in combination with adalimumab: the randomised CONCERTO trial. Annals of the rheumatic diseases. (2015) 74 6 pp1037-1044,10.1136/annrheumdis-2013-204769,,,,Missing EZProxy credentials.,unreachable,,na
9737980,"Atsumi T; Yamamoto K; Takeuchi T; Yamanaka H; Ishiguro N; Tanaka Y; Eguchi K; Watanabe A; Origasa H; Shoji T; Togo O; Okada T; Van Der Heijde; D M; Miyasaka N; Koike T. The first, multicenter, double-blind, randomized, parallel-group study of certolizumab pegol in early rheumatoid arthritis demonstrates inhibition of joint damage progression. Arthritis and rheumatology. (2014) 66 SUPPL. 10 ppS1078-S1079",10.1136/annrheumdis-2014-eular.1448,,,,Missing EZProxy credentials.,unreachable,,na
9741317,Tanaka Yoshiya; Atsumi Tatsuya; Yamamoto Kazuhiko; Takeuchi Tsutomu; Yamanaka Hisashi; Ishiguro Naoki; Eguchi Katsumi; Watanabe Akira; Origasa Hideki; Shoji Toshiharu; Miyasaka Nobuyuki; Koike Takao. Factors associated with successful discontinuation of certolizumab pegol in early rheumatoid arthritis. International journal of rheumatic diseases. (2020) 23 3 pp316-324,10.1111/1756-185x.13780,https://onlinelibrary.wiley.com/doi/pdf/10.1111/1756-185X.13780,https://onlinelibrary.wiley.com/doi/pdf/10.1111/1756-185X.13780,,,html,,PDF
11088227,Tanaka Yoshiya; Atsumi Tatsuya; Yamamoto Kazuhiko; Takeuchi Tsutomu; Yamanaka Hisashi; Ishiguro Naoki; Eguchi Katsumi; Watanabe Akira; Origasa Hideki; Shoji Toshiharu; Miyasaka Nobuyuki; Koike Takao. Factors associated with successful discontinuation of certolizumab pegol in early rheumatoid arthritis. International journal of rheumatic diseases. (2020) 23 3 pp316-324,10.1111/1756-185x.13780,https://onlinelibrary.wiley.com/doi/pdf/10.1111/1756-185X.13780,https://onlinelibrary.wiley.com/doi/pdf/10.1111/1756-185X.13780,,,html,,PDF
9261282,Haraoui B; Thorne C; Keystone E; Poulin-Costello M; Trottier E; Vieira A; Pope J. Clinical and radiographic outcomes in patients with rheumatoid arthritis treated with etanercept or etanercept + methotrexate: Two-year results from the canadian methotrexate and etanercept outcome study (CAMEO). Journal of rheumatology. (2014) 41  7 pp1506-1507,10.1136/annrheumdis-2014-eular.1054,,,,Missing EZProxy credentials.,unreachable,,na
9261491,Haraoui B; Thorne JC; Keystone EC; Poulin-Costello M; Trottier E; Vieira A; Pope JE. Clinical and radiographic outcomes with etanercept and etanercept and methotrexate in patients with rheumatoid arthritis: Two-year results from the Canadian methotrexate and etanercept outcome study (CAMEO). Arthritis and rheumatism. (2013) 65  ppS622,10.1093/rheumatology/kev338,http://academic.oup.com/rheumatology/article-pdf/55/2/327/5159107/kev338.pdf,http://academic.oup.com/rheumatology/article-pdf/55/2/327/5159107/kev338.pdf,,,pdf,,PDF
9261809,Pope JE; Keystone EC; Thorne JC; Poulin-Costello M; Phan-Chronis K; Haraoui B. Study completion and etanercept retention in patients with rheumatoid arthritis treated with etanercept monotherapy versus etanercept and methotrexate combination therapy. Arthritis and rheumatology. (2015) 67 no pagination pp,10.1136/annrheumdis-2014-eular.1054,,,,Missing EZProxy credentials.,unreachable,,na
9736948,Pope J; Keystone E; Haraoui B; Thorne J C; Poulin-Costello M. Number of cardiovascular risk factors may be associated with higher disease activity severity. Exploratory analysis of baseline data from the canadian methotrexate and etanercept outcome study: a randomized trial of etanercept and methotrexate vs etanercept alone in rheumatoid arthritis. Arthritis and rheumatism. (2011) 63 10 SUPPL. 1 pp,10.1136/annrheumdis-2012-eular.389,,,,Missing EZProxy credentials.,unreachable,,na
9738955,Pope J E; Keystone E; Haraoui B; Thorne C; Poulin-Costello M. Number of cardiovascular risk factors may be associated with higher disease activity severity. Exploratory analysis of baseline data from the canadian MTX and etanercept outcome study: a randomized trial of etanercept and MTX vs etanercept alone in RA. Annals of the rheumatic disease. (2013) 71 SUPPL. 3 pp,10.1136/annrheumdis-2012-eular.389,,,,Missing EZProxy credentials.,unreachable,,na
9741329,Keystone EC; Pope JE; Thorne JC; Poulin-Costello M; Phan-Chronis K; Vieira A; Haraoui B. Two-year radiographic and clinical outcomes from the Canadian Methotrexate and Etanercept Outcome study in patients with rheumatoid arthritis. Rheumatology. (2016) 55 2 pp327-334,10.1093/rheumatology/kev338,http://academic.oup.com/rheumatology/article-pdf/55/2/327/5159107/kev338.pdf,http://academic.oup.com/rheumatology/article-pdf/55/2/327/5159107/kev338.pdf,,,pdf,,PDF
9260613,Bakker MF; Jacobs JW; Welsing PM; van der Werf JH; Linn-Rasker SP; van der Veen MJ; Lafeber FP; Bijlsma JW; Utrecht Arthritis Cohort Study Group. Are switches from oral to subcutaneous methotrexate or addition of ciclosporin to methotrexate useful steps in a tight control treatment strategy for rheumatoid arthritis? A post hoc analysis of the CAMERA study. Annals of the rheumatic diseases. (2010) 69 10 pp1849-1852,10.1136/ard.2009.124065,,,,Missing EZProxy credentials.,unreachable,,na
9261969,Nair SC; Welsing PM; Jacobs JW; van Laar JM; Rensen WH; Ardine de Wit G; Bijlsma JW; Lafeber FP. Economic evaluation of a tight-control treatment strategy using an imaging device (handscan) for monitoring joint inflammation in early rheumatoid arthritis. Clinical and experimental rheumatology. (2015) 33 6 pp831-838,10.1136/annrheumdis-2014-eular.2890,,,,Missing EZProxy credentials.,unreachable,,na
9261222,Bakker MF; Jacobs JWG; Welsing PMJ; Verstappen SMM; Tekstra J; Ton E; Geurts MAW. Double-blind randomized CAMERA-II trial: Better control of disease and erosive joint damage with inclusion of low-dose prednisone into a MTX-based tight control strategy for early rheumatoid arthritis. Arthritis and rheumatism. (2011) 63 10 SUPPL. 1 pp,10.7326/0003-4819-156-5-201203060-00004,https://www.acpjournals.org/doi/pdf/10.7326/0003-4819-156-5-201203060-00004,https://www.acpjournals.org/doi/pdf/10.7326/0003-4819-156-5-201203060-00004,,,html,,Article
9258294,"Bakker MF; Jacobs JW; Welsing PM; Verstappen SM; Tekstra J; Ton E; Geurts MA; van der Werf JH; van Albada-Kuipers GA; Jahangier-de Veen ZN; van der Veen MJ; Verhoef CM; Lafeber FP; Bijlsma JW; Utrecht Rheumatoid Arthritis Cohort Study Group. Low-dose prednisone inclusion in a methotrexate-based, tight control strategy for early rheumatoid arthritis: a randomized trial. Annals of internal medicine. (2012) 156 5 pp329-339",10.7326/0003-4819-156-5-201203060-00004,https://www.acpjournals.org/doi/pdf/10.7326/0003-4819-156-5-201203060-00004,https://www.acpjournals.org/doi/pdf/10.7326/0003-4819-156-5-201203060-00004,,,html,,Article
9261405,Van Der Goes MC; Jacobs JW; Jurgens MS; Bakker MF; Welsing PM; Bijlsma JW. No decrease in bone mineral density when prednisone is added to a methotrexate-based tight control strategy for early rheumatoid arthritis. Annals of the Rheumatic Disease. (2013) 71  pp,10.1136/annrheumdis-2012-eular.405,,,,Missing EZProxy credentials.,unreachable,,na
9262684,"Safy M; De Hair M; Welsing P; Van Laar J; Jacobs J. Smoking is negatively associated with clinical response to concomitant prednisone use in early rheumatoid arthritis. Annals of the rheumatic diseases. Conference: annual european congress of rheumatology, EULAR 2018. Netherlands. (2018) 77 Supplement 2 pp281-282",10.1136/annrheumdis-2018-eular.6494,,,,Missing EZProxy credentials.,unreachable,,na
9262949,Porter DR; McInnes I; Hunter J; Capell HA. Outcome of second line therapy in rheumatoid arthritis. Annals of the rheumatic diseases. (1994) 53 12 pp812-815,10.1136/ard.53.12.812,,,,Missing EZProxy credentials.,unreachable,,na
9261472,Alten R; Holt R; Grahn A; Rice P; Kent J; Buttgereit F; Gibofsky A. Switching from immediate release (IR) prednisone to delayed release (DR) prednisone improves patient reported outcomes in rheumatoid arthritis (RA) patients on conventional disease-modifying antirheumatic drugs (DMARDS). Arthritis and rheumatism. (2013) 65  ppS963-S964,10.1136/annrheumdis-2014-eular.1467,,,,Missing EZProxy credentials.,unreachable,,na
9738855,"Dejaco C; Duftner C. Efficacy of modified-release versus standard prednisone to reduce duration of morning stiffness of the joints in rheumatoid arthritis (CAPRA-1): a double-blind, randomised controlled trial. Journal fur mineralstoffwechsel. (2008) 15 2 pp101",10.3410/f.1099142.555355,,,,Missing EZProxy credentials.,unreachable,,na
9742538,Buttgereit F; Mehta D; Kirwan J; Szechinski J; Boers M; Alten R E; Supronik J; Szombati I; Romer U; Witte S; Witte K G. Low-dose prednisone chronotherapy for rheumatoid arthritis: a randomised clinical trial (CAPRA-2). Annals of the rheumatic diseases. (2012)   pp,10.1136/annrheumdis-2011-201067,,,,Missing EZProxy credentials.,unreachable,,na
9739596,"UMIN000004412. Corticosteroid-sparing effect of Actemra in patients with Rheumatoid Arthritis refractory to anti-TNF agents, methotrexate and corticosteroid. http://www.who.int/trialsearch/Trial2.aspx?TrialID=JPRN-UMIN000004412. (2010)   pp",10.1186/isrctn62900439,,,,Missing EZProxy credentials.,unreachable,,na
9257468,Scott IC; Walker J; Quist J; Spain S; Tan R; Okada Y; Raychaudhuri S; Steer S; Cope AP; Lewis CM. Genetic susceptibility variants for rheumatoid arthritis do not associate with radiological progression in early active disease. Rheumatology (United Kingdom). (2014) 53  ppi158,10.1093/rheumatology/keu122.002,http://academic.oup.com/rheumatology/article-pdf/53/suppl_1/i158/9578854/keu122.002.pdf,http://academic.oup.com/rheumatology/article-pdf/53/suppl_1/i158/9578854/keu122.002.pdf,,,pdf,,Article
9257018,"Burmester GR; Rigby WF; van Vollenhoven RF; Kay J; Rubbert-Roth A; Blanco R; Kadva A; Dimonaco S. Tocilizumab combination therapy or monotherapy or methotrexate monotherapy in methotrexate-naive patients with early rheumatoid arthritis: 2-year clinical and radiographic results from the randomised, placebo-controlled FUNCTION trial. Annals of the rheumatic diseases. (2017) 76 7 pp1279-1284",10.1136/annrheumdis-2016-210561,,,,Missing EZProxy credentials.,unreachable,,na
9737322,Ma M H Y; Dahanayake C; Scott I C; Kingsley G H; Cope A P; Scott D L. Serological status: a predictor of response to intensive therapy in rheumatoid arthritis. Lancet. (2013) 381 SUPPL. 1 ppS67,10.1016/s0140-6736(13)60508-5,,,,Missing EZProxy credentials.,unreachable,,na
9737727,Seegobin SD; Ma MHY; Dahanayake C; Cope AP; Scott DL; Lewis CM; Scott IC. ACPA-positive and ACPA-negative rheumatoid arthritis differ in their requirements for combination DMARDs and corticosteroids. Rheumatology (united kingdom). (2014) 53  ppi92-i93,10.1093/rheumatology/keu101.017,http://academic.oup.com/rheumatology/article-pdf/53/suppl_1/i92/9578475/keu101.017.pdf,http://academic.oup.com/rheumatology/article-pdf/53/suppl_1/i92/9578475/keu101.017.pdf,,,pdf,,Article
9738525,Wailoo A; Alava MH; Scott IC; Ibrahim F; Scott DL. Cost-effectiveness of treatment strategies using combination disease-modifying anti-rheumatic drugs and glucocorticoids in early rheumatoid arthritis. Rheumatology (united kingdom). (2014) 53 10 pp1773-1777,10.1093/rheumatology/keu039,http://academic.oup.com/rheumatology/article-pdf/53/10/1773/17388298/keu039.pdf,http://academic.oup.com/rheumatology/article-pdf/53/10/1773/17388298/keu039.pdf,,,pdf,,Article
9739128,Seegobin S D; Ma M H Y; Dahanayake C; Cope A P; Scott D L; Lewis C M; Scott I C. ACPA-positive and ACPA-negative rheumatoid arthritis differ in their requirements for combination DMARDs and corticosteroids. Rheumatology (united kingdom). (2014) 53 SUPPL. 1 pp,10.1093/rheumatology/keu101.017,http://academic.oup.com/rheumatology/article-pdf/53/suppl_1/i92/9578475/keu101.017.pdf,http://academic.oup.com/rheumatology/article-pdf/53/suppl_1/i92/9578475/keu101.017.pdf,,,pdf,,Article
